{
  "$schema": "./catalog.schema.json",
  "schema": 1,
  "name": "CraftCraft",
  "tagline": "Well-known software, rewritten in Rust.",
  "updated": "2026-10-26",
  "refresh_hours": 6,
  "launcher": {
    "version": "0.1.0",
    "repo": "haruny/craftcraft"
  },
  "categories": [
    {
      "id": "creative",
      "name": "Creative"
    },
    {
      "id": "office",
      "name": "Office"
    },
    {
      "id": "engineering",
      "name": "CAD & engineering"
    },
    {
      "id": "utilities",
      "name": "Utilities"
    }
  ],
  "notices": [],
  "apps": [
    {
      "id": "photocraft",
      "name": "PhotoCraft",
      "replaces": [
        "Photoshop"
      ],
      "category": "creative",
      "kind": "gui",
      "tagline": "Image editing that feels familiar",
      "description": "Layers, masks, adjustment layers and type, with real PSD files in and out.",
      "repo": "storytold/photocraft",
      "homepage": "https://getartcraft.com/apps/photocraft",
      "license": "MIT OR Apache-2.0",
      "color": "#2f7bf5",
      "icon": "https://raw.githubusercontent.com/storytold/photocraft/main/assets/app-icon/hicolor/128x128/apps/ai.storyteller.photocraft.png",
      "added": "2026-10-26",
      "assets": {
        "windows-x86_64": "photocraft-*-windows-x64.msi",
        "macos-x86_64": "photocraft-*-macos-universal.dmg",
        "macos-aarch64": "photocraft-*-macos-universal.dmg",
        "linux-x86_64": "photocraft-*-linux-x86_64.AppImage",
        "linux-aarch64": "photocraft-*-linux-aarch64.AppImage",
        "windows-aarch64": "photocraft-*-windows-arm64.msi"
      },
      "bin": [
        "photocraft"
      ],
      "launch": {
        "windows": "%ProgramFiles%\\PhotoCraft\\photocraft.exe",
        "macos": "/Applications/PhotoCraft.app"
      }
    },
    {
      "id": "vectorcraft",
      "name": "VectorCraft",
      "replaces": [
        "Illustrator"
      ],
      "category": "creative",
      "kind": "gui",
      "tagline": "Vector illustration",
      "description": "Pen and shape tools, artboards and gradients, with SVG, PDF and AI import.",
      "repo": "storytold/vectorcraft",
      "homepage": "https://getartcraft.com/apps/vectorcraft",
      "license": "MIT OR Apache-2.0",
      "color": "#e8573f",
      "icon": "https://raw.githubusercontent.com/storytold/vectorcraft/main/assets/app-icon/hicolor/128x128/apps/ai.storyteller.vectorcraft.png",
      "added": "2026-10-26",
      "assets": {
        "windows-x86_64": "vectorcraft-*-windows-x64.msi",
        "macos-x86_64": "vectorcraft-*-macos-universal.dmg",
        "macos-aarch64": "vectorcraft-*-macos-universal.dmg",
        "linux-x86_64": "vectorcraft-*-linux-x86_64.AppImage",
        "linux-aarch64": "vectorcraft-*-linux-aarch64.AppImage",
        "windows-aarch64": "vectorcraft-*-windows-arm64.msi"
      },
      "bin": [
        "vectorcraft"
      ],
      "launch": {
        "windows": "%ProgramFiles%\\VectorCraft\\vectorcraft.exe",
        "macos": "/Applications/VectorCraft.app"
      }
    },
    {
      "id": "filmcraft",
      "name": "FilmCraft",
      "replaces": [
        "Premiere Pro",
        "DaVinci Resolve"
      ],
      "category": "creative",
      "kind": "gui",
      "tagline": "Video editing, color and sound",
      "description": "A timeline editor with color grading and audio mixing in one app.",
      "repo": "storytold/filmcraft",
      "homepage": "https://getartcraft.com/apps/filmcraft",
      "license": "MIT OR Apache-2.0",
      "color": "#8b5cf6",
      "icon": "https://raw.githubusercontent.com/storytold/filmcraft/main/assets/app-icon/hicolor/128x128/apps/ai.storyteller.filmcraft.png",
      "added": "2026-10-26",
      "assets": {
        "windows-x86_64": "filmcraft-*-windows-x64.msi",
        "macos-x86_64": "filmcraft-*-macos-universal.dmg",
        "macos-aarch64": "filmcraft-*-macos-universal.dmg",
        "linux-x86_64": "filmcraft-*-linux-x86_64.AppImage",
        "linux-aarch64": "filmcraft-*-linux-aarch64.AppImage",
        "windows-aarch64": "filmcraft-*-windows-arm64.msi"
      },
      "bin": [
        "filmcraft"
      ],
      "launch": {
        "windows": "%ProgramFiles%\\FilmCraft\\filmcraft.exe",
        "macos": "/Applications/FilmCraft.app"
      }
    },
    {
      "id": "lightcraft",
      "name": "LightCraft",
      "replaces": [
        "Lightroom"
      ],
      "category": "creative",
      "kind": "gui",
      "tagline": "Photo library and raw development",
      "description": "Organize your photos and develop raw files non-destructively, all on your own computer.",
      "repo": "storytold/lightcraft",
      "homepage": "https://getartcraft.com/apps/lightcraft",
      "license": "MIT OR Apache-2.0",
      "color": "#f2a516",
      "icon": "https://raw.githubusercontent.com/storytold/lightcraft/main/assets/app-icon/hicolor/128x128/apps/ai.storyteller.lightcraft.png",
      "added": "2026-10-26",
      "assets": {
        "windows-x86_64": "lightcraft-*-windows-x64.msi",
        "macos-x86_64": "lightcraft-*-macos-universal.dmg",
        "macos-aarch64": "lightcraft-*-macos-universal.dmg",
        "linux-x86_64": "lightcraft-*-linux-x86_64.AppImage",
        "linux-aarch64": "lightcraft-*-linux-aarch64.AppImage",
        "windows-aarch64": "lightcraft-*-windows-arm64.msi"
      },
      "bin": [
        "lightcraft"
      ],
      "launch": {
        "windows": "%ProgramFiles%\\LightCraft\\lightcraft.exe",
        "macos": "/Applications/LightCraft.app"
      }
    },
    {
      "id": "effectcraft",
      "name": "EffectCraft",
      "replaces": [
        "After Effects"
      ],
      "category": "creative",
      "kind": "gui",
      "tagline": "Motion graphics and visual effects",
      "description": "Keyframed compositions, layers and effects for titles, motion design and VFX.",
      "repo": "storytold/effectcraft",
      "homepage": "https://getartcraft.com/apps/effectcraft",
      "license": "MIT OR Apache-2.0",
      "color": "#e0368f",
      "icon": "https://raw.githubusercontent.com/storytold/effectcraft/main/assets/app-icon/hicolor/128x128/apps/ai.storyteller.effectcraft.png",
      "added": "2026-10-26",
      "assets": {
        "windows-x86_64": "effectcraft-*-windows-x64.msi",
        "macos-x86_64": "effectcraft-*-macos-universal.dmg",
        "macos-aarch64": "effectcraft-*-macos-universal.dmg",
        "linux-x86_64": "effectcraft-*-linux-x86_64.AppImage",
        "linux-aarch64": "effectcraft-*-linux-aarch64.AppImage",
        "windows-aarch64": "effectcraft-*-windows-arm64.msi"
      },
      "bin": [
        "effectcraft"
      ],
      "launch": {
        "windows": "%ProgramFiles%\\EffectCraft\\effectcraft.exe",
        "macos": "/Applications/EffectCraft.app"
      }
    },
    {
      "id": "designcraft",
      "name": "DesignCraft",
      "replaces": [
        "InDesign"
      ],
      "category": "creative",
      "kind": "gui",
      "tagline": "Page layout and publishing",
      "description": "Lay out magazines, books and brochures with master pages, text frames and print-ready PDF.",
      "repo": "storytold/designcraft",
      "homepage": "https://getartcraft.com/apps/designcraft",
      "license": "MIT OR Apache-2.0",
      "color": "#7bb51c",
      "icon": "https://raw.githubusercontent.com/storytold/designcraft/main/assets/app-icon/hicolor/128x128/apps/ai.storyteller.designcraft.png",
      "added": "2026-10-26",
      "assets": {
        "windows-x86_64": "designcraft-*-windows-x64.msi",
        "macos-x86_64": "designcraft-*-macos-universal.dmg",
        "macos-aarch64": "designcraft-*-macos-universal.dmg",
        "linux-x86_64": "designcraft-*-linux-x86_64.AppImage",
        "linux-aarch64": "designcraft-*-linux-aarch64.AppImage",
        "windows-aarch64": "designcraft-*-windows-arm64.msi"
      },
      "bin": [
        "designcraft"
      ],
      "launch": {
        "windows": "%ProgramFiles%\\DesignCraft\\designcraft.exe",
        "macos": "/Applications/DesignCraft.app"
      }
    },
    {
      "id": "figcraft",
      "name": "FigCraft",
      "replaces": [
        "Figma"
      ],
      "category": "creative",
      "kind": "gui",
      "tagline": "Interface design and prototyping",
      "description": "Design screens with frames, components and auto layout, then click through prototypes.",
      "repo": "storytold/figcraft",
      "homepage": "https://getartcraft.com/apps/figcraft",
      "license": "MIT OR Apache-2.0",
      "color": "#02da96",
      "icon": "https://raw.githubusercontent.com/storytold/figcraft/main/assets/app-icon/hicolor/128x128/apps/ai.storyteller.figcraft.png",
      "added": "2026-10-26",
      "assets": {
        "windows-x86_64": "figcraft-*-windows-x64.msi",
        "macos-x86_64": "figcraft-*-macos-universal.dmg",
        "macos-aarch64": "figcraft-*-macos-universal.dmg",
        "linux-x86_64": "figcraft-*-linux-x86_64.AppImage",
        "linux-aarch64": "figcraft-*-linux-aarch64.AppImage",
        "windows-aarch64": "figcraft-*-windows-arm64.msi"
      },
      "bin": [
        "figcraft"
      ],
      "launch": {
        "windows": "%ProgramFiles%\\FigCraft\\figcraft.exe",
        "macos": "/Applications/FigCraft.app"
      }
    },
    {
      "id": "soundcraft",
      "name": "SoundCraft",
      "replaces": [
        "Audition"
      ],
      "category": "creative",
      "kind": "gui",
      "tagline": "Recording, editing and mixing audio",
      "description": "Multitrack recording and editing with effects and mixing.",
      "repo": "storytold/soundcraft",
      "homepage": "https://getartcraft.com/apps/soundcraft",
      "license": "MIT OR Apache-2.0",
      "color": "#1fa5c9",
      "icon": "https://raw.githubusercontent.com/storytold/soundcraft/main/assets/app-icon/hicolor/128x128/apps/ai.storyteller.soundcraft.png",
      "added": "2026-10-26",
      "assets": {
        "windows-x86_64": "soundcraft-*-windows-x64.msi",